{
  "$schema": "https://sankarshanmukhopadhyay.github.io/sankarshanmukhopadhyay/schemas/portfolio-finding-feed.schema.json",
  "schema_version": "2.0",
  "generated_at": "2026-10-15T21:21:50Z",
  "repository": "dtg-conformance-assurance",
  "artifact_type": "repository-remediation-dossier",
  "repository_snapshot": {
    "observed_at": "2026-10-15T21:21:50Z",
    "default_branch": null,
    "head_sha": null,
    "provenance_status": "unavailable"
  },
  "assessment": {
    "operational": {
      "status": "not-evaluated",
      "description": "Repository availability and observable default-branch automation health.",
      "open_findings": 0
    },
    "governance": {
      "status": "not-evaluated",
      "description": "Portfolio review, status-declaration, lifecycle, and repository identity governance checks.",
      "open_findings": 0
    },
    "assurance": {
      "status": "not-evaluated",
      "description": "Repository-specific assurance evidence coverage, execution state, provenance and freshness against governed repository revisions.",
      "open_findings": 0
    },
    "cross_specification": {
      "status": "not-evaluated",
      "description": "Cross-specification pressure-test evidence is not yet ingested as a portfolio-wide assurance dimension.",
      "open_findings": 0
    }
  },
  "source": {
    "monitor": "https://github.com/sankarshanmukhopadhyay/sankarshanmukhopadhyay",
    "dashboard": "https://sankarshanmukhopadhyay.github.io/sankarshanmukhopadhyay/docs/portfolio-assurance/dashboard.html",
    "latest_report": "https://sankarshanmukhopadhyay.github.io/sankarshanmukhopadhyay/reports/portfolio-assurance/latest.html"
  },
  "finding_count": 0,
  "findings": [],
  "lifecycle": [],
  "handoff": {
    "authority": "repository-local-governance",
    "intended_use": "Supply this dossier with the affected repository source during remediation planning and implementation.",
    "closure_rule": "A finding is closed only when a later monitor run no longer observes the condition and records closure evidence in the lifecycle registry."
  }
}
