{
  "$schema": "https://sankarshanmukhopadhyay.github.io/sankarshanmukhopadhyay/schemas/portfolio-finding-feed.schema.json",
  "schema_version": "2.0",
  "generated_at": "2026-10-24T15:56:19Z",
  "repository": "TRQP-TSPP",
  "artifact_type": "repository-remediation-dossier",
  "repository_snapshot": {
    "observed_at": "2026-10-24T15:56:19Z",
    "default_branch": "main",
    "head_sha": "e4c05acf9dc0c291891ddb803589656158451cba",
    "provenance_status": "observed"
  },
  "assessment": {
    "operational": {
      "status": "evaluated",
      "description": "Repository availability and observable default-branch automation health.",
      "open_findings": 0
    },
    "governance": {
      "status": "evaluated",
      "description": "Portfolio review, status-declaration, lifecycle, and repository identity governance checks.",
      "open_findings": 0
    },
    "assurance": {
      "status": "evaluated",
      "description": "Repository-specific assurance evidence coverage, execution state, provenance and freshness against governed repository revisions.",
      "open_findings": 1
    },
    "cross_specification": {
      "status": "not-evaluated",
      "description": "Cross-specification pressure-test evidence is not yet ingested as a portfolio-wide assurance dimension.",
      "open_findings": 0
    }
  },
  "source": {
    "monitor": "https://github.com/sankarshanmukhopadhyay/sankarshanmukhopadhyay",
    "dashboard": "https://sankarshanmukhopadhyay.github.io/sankarshanmukhopadhyay/docs/portfolio-assurance/dashboard.html",
    "latest_report": "https://sankarshanmukhopadhyay.github.io/sankarshanmukhopadhyay/reports/portfolio-assurance/latest.html"
  },
  "finding_count": 1,
  "findings": [
    {
      "finding_id": "PAM-CB92CF8536F7",
      "finding_fingerprint": "PF-9C213FA6D34C",
      "repository": "TRQP-TSPP",
      "rule_id": "ASSURANCE_EVIDENCE_MISSING",
      "subject": ".github/workflows/pages.yml",
      "severity": "high",
      "observed_at": "2026-10-24T15:56:19Z",
      "claim": "Required assurance evidence satisfying the configured evidence contract was not observed.",
      "evidence": {
        "claim": "publication_integrity",
        "state": "missing",
        "reason": "no completed workflow execution satisfying the configured evidence contract was observed",
        "freshness_policy": "latest-success",
        "repository_head_sha": null,
        "evidence_head_sha": null,
        "workflow": null
      },
      "recommended_action": "Restore or execute the repository-native assurance control and publish observable evidence.",
      "dimension": "assurance",
      "remediation": {
        "objective": "Restore or execute the repository-native control required by the governed assurance contract.",
        "acceptance_criteria": [
          "The required evidence is observable inside the governed lookback window.",
          "The evidence is attributable to the configured repository-native control."
        ],
        "verification": [
          "Execute the required repository-native control and rerun the portfolio monitor."
        ]
      },
      "automatic_effect": "none",
      "routing": {
        "eligible": true,
        "target": "target-repository",
        "minimum_severity": "medium"
      }
    }
  ],
  "lifecycle": [
    {
      "finding_fingerprint": "PF-9C213FA6D34C",
      "repository": "TRQP-TSPP",
      "rule_id": "ASSURANCE_EVIDENCE_MISSING",
      "subject": ".github/workflows/pages.yml",
      "dimension": "assurance",
      "status": "open",
      "first_observed": "2026-09-28T03:54:08Z",
      "last_observed": "2026-10-24T15:56:19Z",
      "resolved_at": null,
      "latest_finding_id": "PAM-CB92CF8536F7"
    }
  ],
  "handoff": {
    "authority": "repository-local-governance",
    "intended_use": "Supply this dossier with the affected repository source during remediation planning and implementation.",
    "closure_rule": "A finding is closed only when a later monitor run no longer observes the condition and records closure evidence in the lifecycle registry."
  }
}
